{
  "schema_version": "0.0.0",
  "top_actions": [
    "Escalade recommandee: Medecin (24h)",
    "SKU-0001: option OTC principale",
    "Verifier contre-indications avant delivrance"
  ],
  "top_risks": [
    "WARN: fievre persistante",
    "BLOCKER: dyspnee"
  ],
  "top_questions": [
    "Depuis quand les symptomes se sont-ils aggraves?",
    "La respiration est-elle difficile?"
  ],
  "what_changed": [
    "Nouvelle visite analysee: visit_000001",
    "retrieved=5"
  ],
  "new_rx_delta": [
    "SKU-0001 evidence: ev_0001",
    "Blocker: dyspnee"
  ]
}
